{
  "title": "Applicatieprofiel Zaalreservatie",
  "category": "Applicatieprofiel",
  "usage": "Aanbevolen (vrijwillig)",
  "status": "Standaard in ontwikkeling",
  "responsibleOrganisation": [
    {
      "name": "Agentschap Digitaal Vlaanderen",
      "resourceReference": "https://data.vlaanderen.be/id/organisatie/OVO002949"
    }
  ],
  "publicationDate": "2025-04-17",
  "descriptionFileName": "",
  "specificationDocuments": [],
  "documentation": [],
  "charter": {},
  "reports": [],
  "presentations": [],
  "dateOfRegistration": "2025-01-09",
  "dateOfAcknowledgementByWorkingGroup": "TBD",
  "dateOfAcknowledgementBySteeringCommittee": "TBD",
  "datePublicReviewStart": "TBD",
  "datePublicReviewEnd": "TBD",
  "endOfPublicationDate": ""
}
